product_id, brand, desc, size, original_price, new_price, price_change
1326309,Common Projects,Original Achilles Low White 1528,12,$300,-,
1666871,Common Projects,Original Achilles Low White 1528,12,$300,-,
5867872,Common Projects,Cardholder,os,$159,$128,19.5%
4911615,Common Projects, Achilles Low,8,$310,$279,10.0%
401382,Common Projects,Chelsea in Leather,10,$630,-,
3310016,Common Projects, Achilles Low White,9,$380,-,
547676,Common Projects,Original achilles lowtop,12,$380,-,
1123381,Common Projects,Achilles Mid White,8,$250,$225,10.0%
2466625,Common Projects, Achilles Three Strap White,9,$400,$184,54.0%
3189593,Common Projects, Original Achilles Low,7,$200,$150,25.0%
4278971,Common Projects,Achilles Low White Leather,10,$325,$262,19.38%
4935511,Common Projects,Achilles Low White,9,$230,-,
548966,Common Projects,Safari Boot,8,$93,-,
5268985,Common Projects,white leather slip ons,10,$355,$319,10.14%
4959433,Common Projects,Combat boots,11,$500,$450,10.0%
627915,Common Projects,Combat Boots Grey Suede,9.5,$550,$400,27.27%
3603404,Common Projects, Achilles Strap Low All White Leather,9.5,$239,-,
3752,Common Projects,Tournament Waxed Canvas Black,10.5,$275,-,
1372024,Common Projects,Chelsea Boot,9.5,$400,-,
3512833,Common Projects,BNIB Original Achilles Low Black Sz 41,8,$350,-,
3949210,Common Projects, Derby Shine,8,$364,-,
3408448,Common Projects,Achilles Low Navy,12,$150,$135,10.0%
331569,Common Projects,Grey Original Achilles Mids,11,$300,-,
5686155,Common Projects, Tan Suede Chelsea Boot,10,$350,$283,19.14%
610189,Common Projects, Chelsea tan,10,$530,-,
2589041,Common Projects,CROSS GRAIN LEATHER SIMPLE BACKPACK brown,os,$683,-,
7242453,Common Projects,FW10 Combat Boots,9,$350,-,
914856,Common Projects,Shine derby shoes,8,$650,$585,10.0%
310164,Common Projects,Achilles Vintage Low Navy,6,$250,$225,10.0%
3381108,Common Projects,Achilles  Natural,9,$350,-,
6079457,Common Projects,Achilles High Grey,11,$200,$180,10.0%
2780455,Common Projects, Blackwhite Cap Toe SS15,10.5,$375,$219,41.6%
3428331,Common Projects,Chelsea Boots  Blush Suede,9,$550,$445,19.09%
5161849,Common Projects,Common Project Achilles Mid  White Leather,10,$80,-,
170559,Common Projects,Achilles Low Patent Navy,11,$150,-,
1929714,Common Projects, Chelsea Boot  Sand,7,$475,$279,41.26%
259239,Common Projects,track leather sneakers low,10,$214,$172,19.63%
8456530,Common Projects, Combat Boots,10,$390,$315,19.23%
6113376,Common Projects,Achilles low white,12,$350,$283,19.14%
8423119,Common Projects,FW17 Winter Combat Boots,9,$400,$375,6.25%
7637439,Common Projects, Achilles Low White,6.5,$305,$274,10.16%
4011394,Common Projects,Chelsea,9,$350,$315,10.0%
989998,Common Projects,Achilles low,9,$270,-,
5349058,Common Projects,Achilles Low,11,$220,-,
3381105,Common Projects,Achilles  Natural,8,$350,-,
1647806,Common Projects,5 Hope Slip On Sneakers,8,$175,-,
3048236,Common Projects,Tournament Low,8,$121,-,
8218494,Common Projects, SOFT LEATHER MULTI CARD HOLDER BLACK,os,$120,$108,10.0%
6369926,Common Projects,Achilles Low White,12,$290,$261,10.0%
7743914,Common Projects,Penny Loafers,11,$315,$283,10.16%
7902849,Common Projects, Achilles Low Suede White,11,$120,-,
6166892,Common Projects,FINAL PRICE DROP  Track in Waxed Suede Black Sneaker,11,$230,$167,27.39%
5881228,Common Projects,Suede Chelsea Boots Olive Waxed,10,$300,$270,10.0%
1702043,Common Projects,Achilles Mid Grey,7,$440,$233,47.05%
1589639,Common Projects,White Achilles Low,10,$375,-,
2802038,Common Projects,Brand New CrossGrain Brown Leather Backpack,os,$629,-,
764607,Common Projects,White red,8,$335,-,
2144068,Common Projects  Tim Coppens, x Tim Coppins samples,11,$220,$160,27.27%
3426839,Common Projects  Robert Geller, x Robert Geller Derby,9,$320,$209,34.69%
2396182,Common Projects  Robert Geller, Robert Geller Sand Waxed Suede Chelsea Boot US Size 8 EUR 41,8,$450,$405,10.0%
2888623,Common Projects,White Leather Slip On Sneaker,10,$298,-,
5452332,Common Projects, Chelsea Boots Sand Tan,9,$400,-,
4491470,Common Projects,Achilles Low,12,$200,$180,10.0%
3196704,Common Projects, Achilles Saffiano Leather Sneakers,10.5,$370,$333,10.0%
1401244,Common Projects,Suede Chelsea Boots in Tobacco,10,$450,-,
876182,Common Projects  Robert Geller,RG Chelsea Waxed Suede Beige,12,$750,$441,41.2%
2863007,Common Projects,Track Shoe  44,11,$275,$222,19.27%
6866392,Common Projects, Olive Chelsea Boots,8,$300,-,
2797397,Common Projects, Chelsea Boot in Suede 1897 Grey,7,$330,$297,10.0%
248212,Common Projects, Achilles Low,6.5,$415,-,
4188261,Common Projects,Low Tops,8.5,$100,-,
1874522,Common Projects, ACHILLES SPECIAL EDITION US 8  EU 41,8,$230,-,
1095168,Common Projects,Achilles Black,10,$360,-,
2801,Common Projects,Winter Postal Boot,7,$225,$203,9.78%
6802136,Common Projects, BBALL RETRO LOW WHITE  NEW,8,$246,-,
7646733,Common Projects, Achilles White sz 42,9,$175,$101,42.29%
5574974,Common Projects, Chelsea Boot,8,$200,-,
2270580,Common Projects,Original Achilles Mid Blush,11,$320,$288,10.0%
2009107,Common Projects,Robert Geller X  Suede Chelsea Boots,10,$400,-,
6806318,Common Projects,Derby Shine Black,10.5,$300,-,
1094944,Common Projects  Robert Geller,Track HighTop Sneakers,10,$330,$297,10.0%
6998506,Common Projects,Common Project Original Achilles Low Suede Blush,10,$300,$243,19.0%
4512819,Common Projects,Achilles Low Suede Taupe,7,$300,$142,52.67%
2061442,Common Projects,Common Project Achilles Low Vintage,6.5,$180,$162,10.0%
411595,Common Projects,Bball Leather Low in Black47,14,$330,$267,19.09%
6289823,Common Projects,cadet derby shoes black,11,$464,-,
3428809,Common Projects,Track Sneaker  Black,9,$475,-,
5129555,Common Projects,ACHILLES LOW ROSE ANTIQUE,7,$158,-,
6988891,Common Projects  Robert Geller,Chelsea Boot,12,$385,$311,19.22%
2269018,Common Projects,Black Suede Bball Highs 45,12,$334,$270,19.16%
539812,Common Projects,Original Achilles High Vintage 43,10,$189,-,
3402379,Common Projects,Achilles Low Dark Grey,9,$230,$207,10.0%
2426477,Common Projects  Robert Geller,SlipOns  last drop,11,$350,$254,27.43%
4770978,Common Projects,Tan Chelsea Boot,8,$270,$243,10.0%
6806274,Common Projects,Suede Chelsea Boot OliveDk Green,9.5,$430,$278,35.35%
6339852,Common Projects, White,10,$220,-,
6706215,Common Projects,Chelsea Boots,9.5,$250,$130,48.0%
6023456,Common Projects, Chelsea Boot Taupe,13,$325,$235,27.69%
7913156,Common Projects,Chelsea Boot In Suede Tan,8,$325,$285,12.31%
